{"trace_schema_version":"1.0.0","agent":"repo_maint","run_id":"2026-09-27T00-44-22Z-3341c6","summary":{"steps":0,"tool_calls":0,"llm_calls":0,"total_latency_ms":4743.695,"cost_usd":0.0,"guard_retries":0},"spans":[{"id":"s1","parent_id":null,"kind":"run","name":"repo_maint","started_at":"2026-09-27T00:44:22.849Z","duration_ms":4743.695,"status":"ok","error":null,"attrs":{"run_id":"2026-09-27T00-44-22Z-3341c6","status":"ok"}},{"id":"s2","parent_id":"s1","kind":"phase","name":"fetch","started_at":"2026-09-27T00:44:22.849Z","duration_ms":4668.154,"status":"ok","error":null,"attrs":{}},{"id":"s3","parent_id":"s2","kind":"custom","name":"fetch:Kghaffari26/repo-maintain-agent","started_at":"2026-09-27T00:44:22.850Z","duration_ms":3561.072,"status":"ok","error":null,"attrs":{"github_requests":12,"github_304s":6,"partial":false}},{"id":"s4","parent_id":"s3","kind":"http","name":"GET api.github.com","started_at":"2026-09-27T00:44:22.850Z","duration_ms":498.796,"status":"ok","error":null,"attrs":{"method":"GET","url":"https://api.github.com/repos/Kghaffari26/repo-maintain-agent","download":true,"retries":0,"status":304,"modified":false,"bytes":6043}},{"id":"s5","parent_id":"s3","kind":"http","name":"GET api.github.com","started_at":"2026-09-27T00:44:23.350Z","duration_ms":250.968,"status":"ok","error":null,"attrs":{"method":"GET","url":"https://api.github.com/repos/Kghaffari26/repo-maintain-agent/labels?per_page=100","download":true,"retries":0,"status":304,"modified":false,"bytes":2807}},{"id":"s6","parent_id":"s3","kind":"http","name":"GET api.github.com","started_at":"2026-09-27T00:44:23.601Z","duration_ms":233.713,"status":"ok","error":null,"attrs":{"method":"GET","url":"https://api.github.com/repos/Kghaffari26/repo-maintain-agent/issues?state=open&sort=updated&per_page=100","download":true,"retries":0,"status":304,"modified":false,"bytes":2}},{"id":"s7","parent_id":"s3","kind":"http","name":"GET api.github.com","started_at":"2026-09-27T00:44:23.835Z","duration_ms":274.146,"status":"ok","error":null,"attrs":{"method":"GET","url":"https://api.github.com/repos/Kghaffari26/repo-maintain-agent/issues?state=all&since=2026-07-05T00%3A44%3A22Z&sort=updated&per_page=100","download":true,"retries":0,"status":304,"modified":false,"bytes":2}},{"id":"s8","parent_id":"s3","kind":"http","name":"GET api.github.com","started_at":"2026-09-27T00:44:24.110Z","duration_ms":245.85,"status":"ok","error":null,"attrs":{"method":"GET","url":"https://api.github.com/repos/Kghaffari26/repo-maintain-agent/issues?state=closed&since=2026-03-31T00%3A44%3A22Z&sort=updated&per_page=100","download":true,"retries":0,"status":304,"modified":false,"bytes":2}},{"id":"s9","parent_id":"s3","kind":"http","name":"GET api.github.com","started_at":"2026-09-27T00:44:24.357Z","duration_ms":245.507,"status":"ok","error":null,"attrs":{"method":"GET","url":"https://api.github.com/repos/Kghaffari26/repo-maintain-agent/pulls?state=open&sort=updated&direction=desc&per_page=100","download":true,"retries":0,"status":304,"modified":false,"bytes":2}},{"id":"s10","parent_id":"s3","kind":"http","name":"GET api.github.com","started_at":"2026-09-27T00:44:24.602Z","duration_ms":293.467,"status":"ok","error":null,"attrs":{"method":"GET","url":"https://api.github.com/repos/Kghaffari26/repo-maintain-agent/commits/main/check-runs","from_cache":false,"retries":0,"status":200,"bytes":33}},{"id":"s11","parent_id":"s3","kind":"http","name":"GET api.github.com","started_at":"2026-09-27T00:44:24.896Z","duration_ms":299.551,"status":"error","error":"HttpError: GET https://api.github.com/repos/Kghaffari26/repo-maintain-agent/releases/latest -> 404","attrs":{"method":"GET","url":"https://api.github.com/repos/Kghaffari26/repo-maintain-agent/releases/latest","from_cache":false,"retries":0}},{"id":"s12","parent_id":"s3","kind":"http","name":"GET api.github.com","started_at":"2026-09-27T00:44:25.196Z","duration_ms":236.808,"status":"ok","error":null,"attrs":{"method":"GET","url":"https://api.github.com/repos/Kghaffari26/repo-maintain-agent/tags?per_page=100","from_cache":false,"retries":0,"status":200,"bytes":2}},{"id":"s13","parent_id":"s3","kind":"http","name":"GET api.github.com","started_at":"2026-09-27T00:44:25.433Z","duration_ms":333.858,"status":"ok","error":null,"attrs":{"method":"GET","url":"https://api.github.com/repos/Kghaffari26/repo-maintain-agent/community/profile","from_cache":false,"retries":0,"status":200,"bytes":477}},{"id":"s14","parent_id":"s3","kind":"http","name":"GET api.github.com","started_at":"2026-09-27T00:44:25.767Z","duration_ms":273.436,"status":"ok","error":null,"attrs":{"method":"GET","url":"https://api.github.com/repos/Kghaffari26/repo-maintain-agent/pulls?state=closed&sort=updated&direction=desc&per_page=100&page=1","from_cache":false,"retries":0,"status":200,"bytes":2}},{"id":"s15","parent_id":"s3","kind":"http","name":"GET api.github.com","started_at":"2026-09-27T00:44:26.041Z","duration_ms":369.614,"status":"ok","error":null,"attrs":{"method":"GET","url":"https://api.github.com/repos/Kghaffari26/repo-maintain-agent/commits?sha=main&since=2026-08-28T00%3A44%3A22Z&per_page=80","from_cache":false,"retries":0,"status":200,"bytes":85466}},{"id":"s16","parent_id":"s2","kind":"custom","name":"fetch:Kghaffari26/agents-core","started_at":"2026-09-27T00:44:26.411Z","duration_ms":110.802,"status":"error","error":"GitHubRequestError: GET /repos/Kghaffari26/agents-core failed: GET https://api.github.com/repos/Kghaffari26/agents-core -> 403","attrs":{}},{"id":"s17","parent_id":"s16","kind":"http","name":"GET api.github.com","started_at":"2026-09-27T00:44:26.411Z","duration_ms":110.548,"status":"error","error":"HttpError: GET https://api.github.com/repos/Kghaffari26/agents-core -> 403","attrs":{"method":"GET","url":"https://api.github.com/repos/Kghaffari26/agents-core","download":true,"retries":0}},{"id":"s18","parent_id":"s2","kind":"custom","name":"fetch:Kghaffari26/real-estate-agent","started_at":"2026-09-27T00:44:26.522Z","duration_ms":255.231,"status":"error","error":"GitHubRequestError: GET /repos/Kghaffari26/real-estate-agent failed: GET https://api.github.com/repos/Kghaffari26/real-estate-agent -> 403","attrs":{}},{"id":"s19","parent_id":"s18","kind":"http","name":"GET api.github.com","started_at":"2026-09-27T00:44:26.522Z","duration_ms":255.027,"status":"error","error":"HttpError: GET https://api.github.com/repos/Kghaffari26/real-estate-agent -> 403","attrs":{"method":"GET","url":"https://api.github.com/repos/Kghaffari26/real-estate-agent","download":true,"retries":0}},{"id":"s20","parent_id":"s2","kind":"custom","name":"fetch:Kghaffari26/fed-agent","started_at":"2026-09-27T00:44:26.778Z","duration_ms":225.024,"status":"error","error":"GitHubRequestError: GET /repos/Kghaffari26/fed-agent failed: GET https://api.github.com/repos/Kghaffari26/fed-agent -> 403","attrs":{}},{"id":"s21","parent_id":"s20","kind":"http","name":"GET api.github.com","started_at":"2026-09-27T00:44:26.778Z","duration_ms":224.755,"status":"error","error":"HttpError: GET https://api.github.com/repos/Kghaffari26/fed-agent -> 403","attrs":{"method":"GET","url":"https://api.github.com/repos/Kghaffari26/fed-agent","download":true,"retries":0}},{"id":"s22","parent_id":"s2","kind":"custom","name":"fetch:Kghaffari26/sam-agent","started_at":"2026-09-27T00:44:27.003Z","duration_ms":258.232,"status":"error","error":"GitHubRequestError: GET /repos/Kghaffari26/sam-agent failed: GET https://api.github.com/repos/Kghaffari26/sam-agent -> 403","attrs":{}},{"id":"s23","parent_id":"s22","kind":"http","name":"GET api.github.com","started_at":"2026-09-27T00:44:27.003Z","duration_ms":257.881,"status":"error","error":"HttpError: GET https://api.github.com/repos/Kghaffari26/sam-agent -> 403","attrs":{"method":"GET","url":"https://api.github.com/repos/Kghaffari26/sam-agent","download":true,"retries":0}},{"id":"s24","parent_id":"s2","kind":"custom","name":"fetch:Kghaffari26/agents-hub","started_at":"2026-09-27T00:44:27.261Z","duration_ms":255.584,"status":"error","error":"GitHubRequestError: GET /repos/Kghaffari26/agents-hub failed: GET https://api.github.com/repos/Kghaffari26/agents-hub -> 403","attrs":{}},{"id":"s25","parent_id":"s24","kind":"http","name":"GET api.github.com","started_at":"2026-09-27T00:44:27.261Z","duration_ms":255.319,"status":"error","error":"HttpError: GET https://api.github.com/repos/Kghaffari26/agents-hub -> 403","attrs":{"method":"GET","url":"https://api.github.com/repos/Kghaffari26/agents-hub","download":true,"retries":0}},{"id":"s26","parent_id":"s1","kind":"phase","name":"transform","started_at":"2026-09-27T00:44:27.517Z","duration_ms":0.268,"status":"ok","error":null,"attrs":{}},{"id":"s27","parent_id":"s26","kind":"custom","name":"compute:Kghaffari26/repo-maintain-agent","started_at":"2026-09-27T00:44:27.517Z","duration_ms":0.245,"status":"ok","error":null,"attrs":{"health":94,"untriaged":0,"stale_prs":0,"changelog_items":12}},{"id":"s28","parent_id":"s1","kind":"phase","name":"analyze","started_at":"2026-09-27T00:44:27.517Z","duration_ms":72.362,"status":"ok","error":null,"attrs":{}},{"id":"s29","parent_id":"s28","kind":"custom","name":"repo:Kghaffari26/repo-maintain-agent","started_at":"2026-09-27T00:44:27.588Z","duration_ms":0.496,"status":"ok","error":null,"attrs":{"health":94,"triaged":0,"actions":0,"applied":0}},{"id":"s30","parent_id":"s29","kind":"custom","name":"triage:Kghaffari26/repo-maintain-agent","started_at":"2026-09-27T00:44:27.588Z","duration_ms":0.012,"status":"ok","error":null,"attrs":{"untriaged":0,"cached":0,"fresh":0,"skipped":0,"model":true}},{"id":"s31","parent_id":"s29","kind":"custom","name":"changelog:Kghaffari26/repo-maintain-agent","started_at":"2026-09-27T00:44:27.588Z","duration_ms":0.103,"status":"ok","error":null,"attrs":{"items":12,"source":"commits","narrative_source":"llm","cached":true}},{"id":"s32","parent_id":"s1","kind":"phase","name":"publish","started_at":"2026-09-27T00:44:27.590Z","duration_ms":2.471,"status":"ok","error":null,"attrs":{}}],"trun